{
  "event_id": "evt_inquiry_001",
  "event_type": "inquiry",
  "event_timestamp": "2026-03-30T20:15:00Z",
  "channel": "whatsapp",
  "conversation_id": "conv_001",
  "customer_id": "cus_001",
  "stay_id": "stay_001",
  "source": "guest",
  "event_metadata": {
    "question": "What time is breakfast?",
    "intent": "amenities",
    "response_time_seconds": 4.2
  }
}
